{"content_sha256":"e26b7ea2060eb64693414668545c5b537f537c4a6772bd3d970309d0167b65c8","index_digest":"146653e424598e2cb3d6d15cf8632fee2997ab3543821fd6cf5b9aa9ac179137","materializer_id":"country_outage_p2_s1_source_view_builder","materializer_version":"1.0.0","member_keys_digest":"b1d83444410094cac69cd9e2f9884d2fcfed443785132ab8ad42ee72b383ab82","population_id":"fixed_cohort_member_rows","profile_bindings":{},"publication_id":"publication_fixture_ir_1","receipt_id":"p2s1_materialization_receipt_v1_38ca5b58224d1619f45bfbf1b80d8d26f3ec9c023b18ea513aa9bbfca3733dc3","row_count":1,"row_file_sha256":"0276856725f067d999d266c62b232dd953b515e2c9f04323da30088c7132826c","schema_sha256":"821c1bb18da0c8e832f7da7b09dc6319ae328a361740ed49cc81ec953c26ac21","schema_version":"country_outage_p2_s1_materialization_receipt_v1","source_refs":[{"authority":"rrc25_authoritative_offline_projection","content_sha256":"cccccccccccccccccccccccccccccccccccccccccccccccccccccccccccccccc","dataset_id":"affected-as-result-set-fixture","manifest_sha256":"bbbbbbbbbbbbbbbbbbbbbbbbbbbbbbbbbbbbbbbbbbbbbbbbbbbbbbbbbbbbbbbb","publication_id":"publication_fixture_ir_1","source_kind":"affected_as_result_set"},{"authority":"rrc25_authoritative_artifact","content_sha256":"2222222222222222222222222222222222222222222222222222222222222222","dataset_id":"cohort_fixture","manifest_sha256":"1111111111111111111111111111111111111111111111111111111111111111","publication_id":"publication_fixture_ir_1","source_kind":"event_cohort"},{"authority":"rrc25_authoritative_artifact","content_sha256":"4444444444444444444444444444444444444444444444444444444444444444","dataset_id":"metric_fixture","manifest_sha256":"3333333333333333333333333333333333333333333333333333333333333333","publication_id":"publication_fixture_ir_1","source_kind":"event_metric"},{"authority":"rrc25_authoritative_offline_projection","content_sha256":"6666666666666666666666666666666666666666666666666666666666666666","dataset_id":"route_state_fixture","manifest_sha256":"5555555555555555555555555555555555555555555555555555555555555555","publication_id":"publication_fixture_ir_1","source_kind":"exact_route_state_projection"},{"authority":"rrc25_authoritative_offline_projection","content_sha256":"8888888888888888888888888888888888888888888888888888888888888888","dataset_id":"path_fixture","manifest_sha256":"7777777777777777777777777777777777777777777777777777777777777777","publication_id":"publication_fixture_ir_1","source_kind":"window_path_association"}],"status":"materialized_ready"}
