{"content_sha256":"2fb1a8beb3ea7b38c0b2cfbf7e6a67815d502af5902f9bf8ed8e9fd32c872800","index_digest":"87b893aba20824c1396dbcb82d0086c41f1f4133a69bd22c6dd27508a7f90253","materializer_id":"country_outage_p2_s1_source_view_builder","materializer_version":"1.0.0","member_keys_digest":"076ded2d141513435f09ebe60cc45e9355265fe8ab8214649adc83aa9ac63764","population_id":"new_prefix_state_rows","profile_bindings":{"new_prefix_projection_profile_digest":"e6518772ed2866d80e586b6506be0b8217074c610d4189313229fad088c0feeb","new_prefix_projection_profile_id":"PROFILE-NEW-PREFIX-FIXED-FIRST-OBSERVED-DIRECTIONS-1.0.0"},"publication_id":"publication_fixture_ir_1","receipt_id":"p2s1_materialization_receipt_v1_e872bb6c50eb1dc3ea6a261a2f531c3ace9ca474c3442f6065c0a420cb62322a","row_count":2,"row_file_sha256":"f84208fc3f1b1ceac63e75225f92182c9e7c191d2218fe98c0fcf489f489fd55","schema_sha256":"277f0be6af8d8257d511069e5227275163ed5580e7703a42c42e590fad54daf8","schema_version":"country_outage_p2_s1_materialization_receipt_v1","source_refs":[{"authority":"rrc25_authoritative_offline_projection","content_sha256":"cccccccccccccccccccccccccccccccccccccccccccccccccccccccccccccccc","dataset_id":"affected-as-result-set-fixture","manifest_sha256":"bbbbbbbbbbbbbbbbbbbbbbbbbbbbbbbbbbbbbbbbbbbbbbbbbbbbbbbbbbbbbbbb","publication_id":"publication_fixture_ir_1","source_kind":"affected_as_result_set"},{"authority":"rrc25_authoritative_artifact","content_sha256":"2222222222222222222222222222222222222222222222222222222222222222","dataset_id":"cohort_fixture","manifest_sha256":"1111111111111111111111111111111111111111111111111111111111111111","publication_id":"publication_fixture_ir_1","source_kind":"event_cohort"},{"authority":"rrc25_authoritative_artifact","content_sha256":"4444444444444444444444444444444444444444444444444444444444444444","dataset_id":"metric_fixture","manifest_sha256":"3333333333333333333333333333333333333333333333333333333333333333","publication_id":"publication_fixture_ir_1","source_kind":"event_metric"},{"authority":"rrc25_authoritative_offline_projection","content_sha256":"6666666666666666666666666666666666666666666666666666666666666666","dataset_id":"route_state_fixture","manifest_sha256":"5555555555555555555555555555555555555555555555555555555555555555","publication_id":"publication_fixture_ir_1","source_kind":"exact_route_state_projection"},{"authority":"rrc25_authoritative_offline_projection","content_sha256":"8888888888888888888888888888888888888888888888888888888888888888","dataset_id":"path_fixture","manifest_sha256":"7777777777777777777777777777777777777777777777777777777777777777","publication_id":"publication_fixture_ir_1","source_kind":"window_path_association"}],"status":"materialized_ready"}
