{"content_sha256":"fd1cbe18c0c27fc261946f7e2f87dab5e20a323ea41cc445b2f248b71f7ef6f0","index_digest":"f1b9d2216b9b087961d86029a6370d25d662fc26e50e4318f3fbd78f4767e642","materializer_id":"country_outage_p2_s1_source_view_builder","materializer_version":"1.0.0","member_keys_digest":"9fba648d2c4bc4c739cdb72d59124a6166a466eab575ef00d4ce20e7284a835c","population_id":"window_path_association_evidence_rows","profile_bindings":{"anchor_content_digest":"cccccccccccccccccccccccccccccccccccccccccccccccccccccccccccccccc","anchor_freeze_digest":"dddddddddddddddddddddddddddddddddddddddddddddddddddddddddddddddd","anchor_manifest_digest":"bbbbbbbbbbbbbbbbbbbbbbbbbbbbbbbbbbbbbbbbbbbbbbbbbbbbbbbbbbbbbbbb","anchor_population_source_ref":"affected-as-result-set-fixture","anchor_result_set_id":"result-set-fixture","eligible_anchor_asn_count":1,"eligible_anchor_asns":[49666],"eligible_anchor_asns_digest":"040c36157f13199fb011d84faa7ca6c2805c10ebabc3a0e61be01d3adb645fe2","path_association_filter_profile_digest":"46ca0955b30a4d43088c214ec5bdf84fbf9b65987bd65047257e85e1d7778eb7","path_association_filter_profile_id":"PROFILE-WINDOW-PATH-ASSOCIATION-FILTER-1.0.0","path_association_index_digest":"f1b9d2216b9b087961d86029a6370d25d662fc26e50e4318f3fbd78f4767e642"},"publication_id":"publication_fixture_ir_1","receipt_id":"p2s1_materialization_receipt_v1_6db5f96a5d8d87f25030bf97d1c979d8648c643ea6f222222b39155e87dfc1e3","row_count":1,"row_file_sha256":"e5490ef061f65d81009dd02caed47a9baa9a89244a3b70b22351242e054a94a4","schema_sha256":"0c545375de5ef0259a1ba82c64511a1a5a0fe116211061e762ac411e2cec199c","schema_version":"country_outage_p2_s1_materialization_receipt_v1","source_refs":[{"authority":"rrc25_authoritative_offline_projection","content_sha256":"cccccccccccccccccccccccccccccccccccccccccccccccccccccccccccccccc","dataset_id":"affected-as-result-set-fixture","manifest_sha256":"bbbbbbbbbbbbbbbbbbbbbbbbbbbbbbbbbbbbbbbbbbbbbbbbbbbbbbbbbbbbbbbb","publication_id":"publication_fixture_ir_1","source_kind":"affected_as_result_set"},{"authority":"rrc25_authoritative_artifact","content_sha256":"2222222222222222222222222222222222222222222222222222222222222222","dataset_id":"cohort_fixture","manifest_sha256":"1111111111111111111111111111111111111111111111111111111111111111","publication_id":"publication_fixture_ir_1","source_kind":"event_cohort"},{"authority":"rrc25_authoritative_artifact","content_sha256":"4444444444444444444444444444444444444444444444444444444444444444","dataset_id":"metric_fixture","manifest_sha256":"3333333333333333333333333333333333333333333333333333333333333333","publication_id":"publication_fixture_ir_1","source_kind":"event_metric"},{"authority":"rrc25_authoritative_offline_projection","content_sha256":"6666666666666666666666666666666666666666666666666666666666666666","dataset_id":"route_state_fixture","manifest_sha256":"5555555555555555555555555555555555555555555555555555555555555555","publication_id":"publication_fixture_ir_1","source_kind":"exact_route_state_projection"},{"authority":"rrc25_authoritative_offline_projection","content_sha256":"8888888888888888888888888888888888888888888888888888888888888888","dataset_id":"path_fixture","manifest_sha256":"7777777777777777777777777777777777777777777777777777777777777777","publication_id":"publication_fixture_ir_1","source_kind":"window_path_association"}],"status":"materialized_ready"}
