{"content_sha256":"caafd2cdca4ef198f9ecae3d270f87627476cb7b34c8cf77026c0d9109ccbbdf","index_digest":"d4a20c835a9884a9a513f1ea19445e5dda796b0aa8263eecca08ca9e7f6ce784","materializer_id":"country_outage_p2_s1_source_view_builder","materializer_version":"1.0.0","member_keys_digest":"9fba648d2c4bc4c739cdb72d59124a6166a466eab575ef00d4ce20e7284a835c","population_id":"window_path_association_evidence_rows","profile_bindings":{"anchor_content_digest":"cccccccccccccccccccccccccccccccccccccccccccccccccccccccccccccccc","anchor_freeze_digest":"dddddddddddddddddddddddddddddddddddddddddddddddddddddddddddddddd","anchor_manifest_digest":"bbbbbbbbbbbbbbbbbbbbbbbbbbbbbbbbbbbbbbbbbbbbbbbbbbbbbbbbbbbbbbbb","anchor_population_source_ref":"affected-as-result-set-fixture","anchor_result_set_id":"result-set-fixture","association_content_digest":"8888888888888888888888888888888888888888888888888888888888888888","association_freeze_digest":"ffffffffffffffffffffffffffffffffffffffffffffffffffffffffffffffff","association_manifest_digest":"7777777777777777777777777777777777777777777777777777777777777777","association_population_complete":true,"association_population_source_ref":"path_fixture","association_source_row_count":1,"association_source_rows_digest":"1b0f188edb64c9360691051c9548c5fa8341d72ff2aadf3a10d7cfdea4bf549a","eligible_anchor_asn_count":1,"eligible_anchor_asns":[49666],"eligible_anchor_asns_digest":"040c36157f13199fb011d84faa7ca6c2805c10ebabc3a0e61be01d3adb645fe2","path_association_filter_profile_digest":"46ca0955b30a4d43088c214ec5bdf84fbf9b65987bd65047257e85e1d7778eb7","path_association_filter_profile_id":"PROFILE-WINDOW-PATH-ASSOCIATION-FILTER-1.0.0","path_association_index_digest":"d4a20c835a9884a9a513f1ea19445e5dda796b0aa8263eecca08ca9e7f6ce784","source_population_binding":{"materialized_row_count":1,"source_population_complete":true,"source_population_content_digest":"8888888888888888888888888888888888888888888888888888888888888888","source_population_freeze_digest":"ffffffffffffffffffffffffffffffffffffffffffffffffffffffffffffffff","source_population_manifest_digest":"7777777777777777777777777777777777777777777777777777777777777777","source_population_projection_cardinality":"one_to_one","source_population_record_refs":[],"source_population_row_count":1,"source_population_rows_digest":"1b0f188edb64c9360691051c9548c5fa8341d72ff2aadf3a10d7cfdea4bf549a","source_population_source_ref":"path_fixture"}},"publication_id":"publication_fixture_ir_1","receipt_id":"p2s1_materialization_receipt_v1_05a053fcd88308ca5698c76b71524518b299439f286144fab8f5b8e1b6bfee74","row_count":1,"row_file_sha256":"4f2d80bc532e98fecd7fbb09df896796917b2e7c94b7b8579abde6a4784dcec6","schema_sha256":"4f7da0f3ed46fe7579d05d45a51176e05f6b6a87118077afa7fe36a399694b6c","schema_version":"country_outage_p2_s1_materialization_receipt_v1","source_refs":[{"authority":"rrc25_authoritative_offline_projection","content_sha256":"cccccccccccccccccccccccccccccccccccccccccccccccccccccccccccccccc","dataset_id":"affected-as-result-set-fixture","manifest_sha256":"bbbbbbbbbbbbbbbbbbbbbbbbbbbbbbbbbbbbbbbbbbbbbbbbbbbbbbbbbbbbbbbb","publication_id":"publication_fixture_ir_1","source_kind":"affected_as_result_set"},{"authority":"rrc25_authoritative_artifact","content_sha256":"2222222222222222222222222222222222222222222222222222222222222222","dataset_id":"cohort_fixture","manifest_sha256":"1111111111111111111111111111111111111111111111111111111111111111","publication_id":"publication_fixture_ir_1","source_kind":"event_cohort"},{"authority":"rrc25_authoritative_artifact","content_sha256":"4444444444444444444444444444444444444444444444444444444444444444","dataset_id":"metric_fixture","manifest_sha256":"3333333333333333333333333333333333333333333333333333333333333333","publication_id":"publication_fixture_ir_1","source_kind":"event_metric"},{"authority":"rrc25_authoritative_offline_projection","content_sha256":"6666666666666666666666666666666666666666666666666666666666666666","dataset_id":"route_state_fixture","manifest_sha256":"5555555555555555555555555555555555555555555555555555555555555555","publication_id":"publication_fixture_ir_1","source_kind":"exact_route_state_projection"},{"authority":"rrc25_authoritative_offline_projection","content_sha256":"8888888888888888888888888888888888888888888888888888888888888888","dataset_id":"path_fixture","manifest_sha256":"7777777777777777777777777777777777777777777777777777777777777777","publication_id":"publication_fixture_ir_1","source_kind":"window_path_association"}],"status":"materialized_ready"}
